{
  "schema_version": "bp-comparison-workload-v3",
  "manifest_id": "bp-perf-v5-decision-1",
  "decision_contract_version": "bp-perf-v5-decision-1",
  "supersedes": "bp-perf-v4-decision-1",
  "seed": 20260825,
  "coordinate_space": "pdf-points-bottom-left",
  "environment": {
    "window_css_pixels": {
      "width": 1200,
      "height": 800
    },
    "display_scale_factor": 1,
    "theme": "light",
    "cache_classes": [
      "app-cold",
      "declared-warm"
    ],
    "input_lanes": [
      "native-replay",
      "semantic-correctness"
    ]
  },
  "source_manifest": {
    "id": "bp-perf-v4-decision-1",
    "file": "./comparison-workload-v4.materialized.json",
    "artifact_sha256": "4a826bd3c19f3c7693128961f43064e5b7414e799a0f791b7f3381ed59e897b1",
    "byte_sha256": "8828be7c4c7c05a19007bd315c4fc1844a93278c967d49614387c2ae6cfeff52"
  },
  "fixtures": [
    {
      "id": "bp-single-page-v1",
      "sha256": "f31adeeb3f17ef180012fe707cb2f2650854305dab4b16bba34d73652b6d8fdc",
      "role": "small-shell-open"
    },
    {
      "id": "nasa-apollo-summary-526-v1",
      "sha256": "68d0f3bb93fd1c4e4f3adf99d483e9161f14293a311e25aa6c31241bbbb84049",
      "role": "long-document"
    },
    {
      "id": "bp-engineering-sheet-v1",
      "sha256": "49b417e4652a5fc0efb3b59b1f482b443bf3133f810f652559931a08b68a2b91",
      "role": "moderate-engineering-sheet"
    },
    {
      "id": "bp-annotation-density-v1",
      "sha256": "1dad337b97d573ff971e886eb6509e80e5e1cd07f6ac610ae4f2f9419c666682",
      "role": "dense-mixed-editing"
    },
    {
      "id": "bp-annotation-all-v1",
      "sha256": "4a0a94cdbcc08e7ee06504914e5b84d218f2aeb01035b42d62f2275e38d02cbd",
      "role": "persistence"
    }
  ],
  "assets": [
    {
      "id": "bp-image-checker-v1",
      "kind": "generated-rgba-png",
      "width_pixels": 512,
      "height_pixels": 384,
      "decoded_payload_bytes": 786432,
      "sha256": "fcc714d1ac60ed4b88abf7297830479c7557cb9d219033e7a5a5ad4d6ec18dda"
    }
  ],
  "journeys": [
    {
      "id": "small-shell-open-v1",
      "fixtures": [
        "bp-single-page-v1"
      ],
      "commands": [
        {
          "id": "small:launch-cold",
          "operation": "app.launch-cold",
          "cache_class": "app-cold",
          "expected_milestones": [
            "process-started",
            "native-window-presented",
            "interactive-shell"
          ]
        },
        {
          "id": "small:open-settle",
          "operation": "document.open-settle",
          "fixture_id": "bp-single-page-v1",
          "expected_milestones": [
            "document-opened",
            "preview-current-generation",
            "settled-current-generation-250ms",
            "fixed-crops-matched"
          ]
        }
      ]
    },
    {
      "id": "nasa-long-document-v1",
      "fixtures": [
        "nasa-apollo-summary-526-v1"
      ],
      "commands": [
        {
          "id": "nasa:open-settle",
          "operation": "document.open-settle",
          "fixture_id": "nasa-apollo-summary-526-v1",
          "expected_milestones": [
            "document-opened",
            "preview-current-generation",
            "settled-current-generation-250ms",
            "virtual-page-window-bounded"
          ]
        },
        {
          "id": "viewer:layout-single",
          "operation": "viewer.set-layout",
          "layout": "single-page",
          "expected_milestones": [
            "per-page-geometry-matched",
            "annotation-thumbnail-current"
          ]
        },
        {
          "id": "viewer:layout-continuous",
          "operation": "viewer.set-layout",
          "layout": "continuous",
          "expected_milestones": [
            "per-page-geometry-matched",
            "virtual-page-window-bounded"
          ]
        },
        {
          "id": "viewer:navigate-normalized",
          "operation": "viewer.navigate-normalized-sequence",
          "page_formula": [
            "last",
            "ceil(0.08*n)",
            "ceil(0.72*n)",
            "ceil(0.25*n)",
            "ceil(0.90*n)",
            "ceil(0.50*n)",
            "11",
            "ceil(0.958*n)",
            "ceil(0.33*n)",
            "1"
          ],
          "clamp": "1..page-count",
          "deduplicate_after_clamp": true,
          "expected_milestones": [
            "target-page-current",
            "preview-current-generation",
            "settled-current-generation-250ms"
          ]
        },
        {
          "id": "viewer:continuous-scroll",
          "operation": "viewer.continuous-scroll-path",
          "fixture_id": "nasa-apollo-summary-526-v1",
          "input_rate_hz": 120,
          "path": {
            "forward_duration_ms": 20000,
            "forward_viewport_heights": 50,
            "pause_duration_ms": 2000,
            "reverse_duration_ms": 10000,
            "finish_page": 1
          },
          "expected_milestones": [
            "timestamped-input-complete",
            "virtual-page-window-bounded",
            "finish-page-current",
            "visible-raster-readiness-observed"
          ]
        },
        {
          "id": "nasa:cache-pressure",
          "operation": "viewer.cache-pressure-cycles",
          "cycles": 5,
          "expected_milestones": [
            "declared-cache-byte-limit-held",
            "decoded-byte-limit-held",
            "renderer-resource-submission-bytes-exact"
          ]
        },
        {
          "id": "viewer:close-recover-reopen",
          "operation": "document.close-recover-reopen",
          "reopen_cache_class": "declared-warm",
          "expected_milestones": [
            "document-resources-released",
            "memory-recovery-recorded",
            "document-reopened",
            "settled-current-generation-250ms"
          ]
        },
        {
          "id": "viewer:dynamic-fidelity-scroll",
          "operation": "viewer.dynamic-fidelity-scroll-path",
          "fixture_id": "nasa-apollo-summary-526-v1",
          "layout": "continuous",
          "input_lane": "native-replay",
          "input_rate_hz": 120,
          "duration_ms": 32000,
          "expected_trajectory_sample_count": 3841,
          "presentation": {
            "zoom_mode": "fixed-percent",
            "zoom_percent": 100,
            "required_x_device_pixels_per_pdf_point": 1,
            "required_y_device_pixels_per_pdf_point": 1,
            "pixels_per_point_tolerance": 0.01,
            "paired_candidate_scale_tolerance": 0.01,
            "client_device_scale": 1,
            "screenshot_source": "presented-client-drawable",
            "page_bounds_source": "painted-page-bounds",
            "stability_receipt": "painted-before-capture-after",
            "candidate_resampling": "forbidden",
            "reference_resampling": "downsample-only-lanczos3"
          },
          "path": {
            "forward_duration_ms": 20000,
            "forward_motion_duration_ms": 19250,
            "forward_viewport_heights": 50,
            "pause_duration_ms": 2000,
            "reverse_duration_ms": 10000,
            "start_page": 1,
            "finish_page": 1,
            "checkpoint_hold_ms": 250,
            "checkpoint_hold_count": 3,
            "checkpoint_hold_interval_count_each": 30,
            "checkpoint_hold_sample_count_each": 31
          },
          "observer": {
            "rate_hz": 60,
            "expected_sample_count": 1921,
            "clock": "monotonic-independent-fixed-cadence"
          },
          "registered_crops": [
            {
              "crop_id": "nasa-scroll-start-page-1-header",
              "fixture_id": "nasa-apollo-summary-526-v1",
              "page_number": 1,
              "pdf_rect": {
                "x": 36,
                "y": 612,
                "width": 538,
                "height": 126
              },
              "checkpoint": {
                "path_fraction": 0,
                "selection": "nearest-full-crop-visibility",
                "hold_index": 0,
                "hold_ms": 250,
                "zero_input_interval_count": 30,
                "zero_input_sample_count": 31
              },
              "reference_raster": {
                "source": "locked-fixture-pdf",
                "dpi": 144,
                "comparison_dpi": 144,
                "color_space": "srgb",
                "comparison": "bp-cross-engine-binary-scan-fidelity-v2",
                "source_scan_dpi": 300,
                "maximum_phase_offset_px": 1,
                "gaussian_sigma_px": 2,
                "gaussian_radius_px": 6,
                "dark_luma_max": 192,
                "dark_match_radius_px": 1,
                "minimum_filtered_ssim": 0.97,
                "minimum_dark_precision": 0.99,
                "minimum_dark_recall": 0.99,
                "minimum_dark_f1": 0.99,
                "candidate_resampling": "none",
                "reference_resampling": "downsample-only-lanczos3",
                "reference_crop_sha256": "9618896b1558e6e92b1b0d10fec4f1480bd74b7e36d749dde07505eabfad8b5a"
              },
              "registration_sha256": "dd76c737bf0dcd52448505eaf0a176c548259fc1b5d87e422994ab4cfdc15d9e"
            },
            {
              "crop_id": "nasa-scroll-middle-page-15-body",
              "fixture_id": "nasa-apollo-summary-526-v1",
              "page_number": 15,
              "pdf_rect": {
                "x": 55,
                "y": 252,
                "width": 500,
                "height": 288
              },
              "checkpoint": {
                "path_fraction": 0.3125,
                "phase": "forward",
                "selection": "nearest-full-crop-visibility",
                "hold_index": 1,
                "hold_ms": 250,
                "zero_input_interval_count": 30,
                "zero_input_sample_count": 31
              },
              "reference_raster": {